{
  "id": "af12c42aaa6102f9",
  "title": "I'm becoming AI-blind",
  "url": "https://cymerys.com/w/im-becoming-ai-blind",
  "source": "Hacker News",
  "type": "article",
  "tags": [
    "tech"
  ],
  "published_at": "2026-08-21T11:48:05.000Z",
  "feed_id": "hackernews",
  "description": "## 개요\n\nAI가 생성한 문서에서 특정 패턴을 인지하게 된 필자의 경험은 AI의 생산성 향상이라는 기대와 달리, 오히려 정보 과부하로 인한 비효율을 초래할 수 있음을 보여준다.\n\n## 주요 내용\n\n-   필자는 최근 업무에서 AI가 생성한 것으로 보이는 문서를 읽을 때 집중력이 저하되고, 문서 내용에 이미 포함된 정보에 대해 질문하는 상황이 반복되고 있음을 인지했다.\n-   이러한 집중력 저하의 공통적인 원인으로 AI 생성의 흔적이 뚜렷한 문서가 지목된다. 예를 들어, Claude의 특징적인 분석과 용어가 포함된 디자인 문서, 마케팅 전략과 기술적 허황된 내용이 혼합된 20페이지 분량의 마케팅 개념 덱, 혹은 의사결정에 대한 불확실성이 엿보이는 장황한 기술 요구사항 문서 등이 해당한다.\n-   저자는 AI 생성 텍스트를 인지하는 것이 어렵다는 연구 결과와 달리, 특히 저품질로 생성된 AI 콘텐츠는 인지하기 쉽다고 주장한다. 소셜 미디어에서 나타나는 AI 생성 패턴과 유사하게, 업무 관련 텍스트에서도 특정 단어 선택, 문장 흐름, 사소한 내용까지 과장하여 소개하는 방식 등이 AI 생성물임을 드러낸다.\n-   필자는 '사전 학습'된 경험을 통해 의미 없이 텍스트만 가득 찬 AI 생성 콘텐츠(LinkedIn 게시글, 이메일, 웹사이트 등)의 징후를 빠르게 파악하고, 사고 없이 무시하게 되는 'AI 블라인드니스' 현상을 겪고 있다고 설명한다. 이는 정보 과잉 시대에 콘텐츠를 필터링하여 정신 건강을 유지하는 방식과 유사하다.\n-   당초 생산성 향상을 위해 사용된 AI가 역설적으로 필자를 늦추는 예상치 못한 방식으로 작용하고 있음을 깨닫고 있다.\n\n## 시사점\n\nAI가 생성한 콘텐츠의 품질 저하 및 정보 과부하 현상은 사용자의 집중력을 저하시키고 오히려 비효율을 야기할 수 있으며, 이에 대한 경계와 효과적인 정보 필터링 전략의 필요성을 제기한다."
}
