{
  "id": "f42860c807f0e608",
  "title": "Multi‑Agent Orchestration: The Next Frontier in AI Collaboration",
  "url": "https://dev.to/seenakhan/multi-agent-orchestration-the-next-frontier-in-ai-collaboration-2fke",
  "source": "Dev.to",
  "type": "article",
  "tags": [
    "dev",
    "agents",
    "ai",
    "architecture",
    "automation"
  ],
  "published_at": "2026-05-10T05:22:27.000Z",
  "feed_id": "devto"
}
