{
  "id": "5ceb73422ae9ca0c",
  "title": "SpaceX IPO: Live updates on everything you need to know",
  "url": "https://techcrunch.com/2026/06/12/spacex-ipo-live-updates-on-everything-you-need-to-know/",
  "source": "TechCrunch",
  "type": "article",
  "tags": [
    "tech",
    "ai",
    "space",
    "transportation",
    "elon musk"
  ],
  "published_at": "2026-06-12T23:15:14.000Z",
  "feed_id": "techcrunch",
  "description": "## 개요\n\nSpaceX가 역사상 최대 규모인 750억 달러 규모의 IPO를 성공적으로 완료하며 나스닥에 상장되었고, 이는 엘론 머스크를 세계 최초의 조만장자로 만들 가능성을 제시합니다.\n\n## 주요 내용\n\n*   SpaceX의 주식은 나스닥 상장 첫날 150달러로 시작하여 19% 상승한 160.95달러로 마감했으며, 장중에는 30%까지 치솟았습니다.\n*   Robinhood 플랫폼은 SpaceX IPO 직후 기록적인 트래픽을 경험했습니다.\n*   SpaceX COO인 긴네 쇼트웰은 CNBC 인터뷰에서 SpaceX와 Tesla의 합병 가능성을 언급하며 엘론 머스크의 부담을 덜어줄 수 있다고 밝혔습니다.\n*   이번 IPO를 통해 Goldman Sachs와 Morgan Stanley와 같은 투자 은행들은 약 5억 달러의 수수료 수익을 올렸습니다.\n*   엘론 머스크는 X(구 트위터)를 통해 SpaceX 직원들에게 감사를 표하며, \"녹색 신발 옵션(green shoe option)\"을 암시하는 듯한 내부 관계자들의 사진을 공유했습니다.\n*   SpaceX는 2025년 180억 달러 이상의 매출에 49억 달러의 손실을 기록했으며, 창사 이래 총 370억 달러 이상의 누적 손실을 기록했습니다.\n*   엘론 머스크는 약 85.1%의 의결권을 보유하고 있으며, 약 4,400명의 SpaceX 직원이 주식 가치 상승으로 인해 백만장자가 될 수 있습니다.\n*   SpaceX의 S-1 서류는 Starlink 위성 인터넷 사업, 370억 달러 이상의 누적 손실, 그리고 xAI 부문을 통한 미래 사업 전망 등을 상세히 공개했습니다.\n*   Starship의 재사용 가능성에 대한 경로가 SpaceX의 S-1 서류와 로켓 시험 비행 결과로 인해 불확실성이 제기되었습니다.\n*   SpaceX는 투자자들에게 향후 희석 가능성에 대해 경고했으며, 이는 Tesla 합병 루머에 불을 지폈습니다.\n*   IPO 이전 SpaceX는 계산 능력(compute)을 판매하는 계약을 체결하여 재무 상태를 개선했으며, Anthropic과 Google은 각각 월 12.5억 달러와 9.2억 달러를 SpaceX에 지불합니다.\n\n## 시사점\n\nSpaceX의 상장은 역사상 최대 규모 IPO로서 투자자, 직원, 그리고 엘론 머스크에게 막대한 금전적 이익을 안겨주었으며, 회사의 재무 상태, 사업 전략, 그리고 미래 성장 가능성에 대한 심층적인 정보를 대중에게 공개했습니다."
}
