{
  "id": "3c4832716babc27e",
  "title": "Show HN: Sx 2.0 – Share AI skills with your team through a Dropbox folder",
  "url": "https://sleuth-io.github.io/sx/2026/07/10/your-dropbox-is-now-a-skill-server.html",
  "source": "Hacker News",
  "type": "article",
  "tags": [
    "tech"
  ],
  "published_at": "2026-07-13T23:26:52.000Z",
  "feed_id": "hackernews"
}
