{
  "id": "53f7980c1cd19906",
  "title": "Claude AI recovers an 11 yrs old BTC wallet holding 400k USD",
  "url": "https://www.tomshardware.com/tech-industry/cryptocurrency/bitcoin-trader-recovers-usd400-000-using-claude-ai-after-losing-wallet-password-11-years-ago-bot-tried-3-5-trillion-passwords-before-decrypting-an-old-wallet-backup",
  "source": "Hacker News",
  "type": "article",
  "tags": [
    "tech"
  ],
  "published_at": "2026-05-14T14:49:48.000Z",
  "feed_id": "hackernews",
  "description": "## 개요\n\nClaude AI가 11년 동안 잠겨 있던 비트코인 지갑을 복구하는 데 결정적인 역할을 했으며, 이 지갑에는 약 40만 달러 상당의 5 BTC가 포함되어 있었습니다.\n\n## 주요 내용\n\n- 사용자는 'stoned' 상태에서 비트코인 지갑 비밀번호를 변경한 후 잊어버렸고, 11년 이상 복구를 시도했습니다.\n- 해당 지갑에는 5 BTC가 있었으며, 이는 현재 약 40만 달러의 가치를 지닙니다.\n- 사용자는 최근 오래된 니모닉(mnemonic)이 실제 비밀번호였음을 발견하고, 자신의 대학 컴퓨터 파일 전체를 Claude에 입력했습니다.\n- Claude는 오래된 백업 지갑 파일을 발견하고 성공적으로 복호화했으며, 복구를 방해하던 비밀번호 설정 오류도 발견했습니다.\n- 초기에 사용자는 btcrecover와 같은 도구로 암호화된 지갑 파일에 접근하려 했으나 실패했습니다.\n- Claude는 cprkrn의 데이터에서 2019년 12월 백업된 지갑 파일을 발견했습니다.\n- Claude는 btcrecover가 시도했던 공유 키와 비밀번호가 제대로 결합되지 않았던 문제점을 발견했습니다.\n- 이 버그 수정과 이전 버전의 지갑 파일을 사용하여 Claude는 btcrecover로 개인 키를 복호화하는 데 성공했습니다.\n- 과거에는 20자 비밀번호로 암호화된 비트코인 지갑을 복구하는 데 최소 6개월이 소요되었습니다.\n\n## 시사점\n\nClaude AI는 직접적으로 비밀번호를 추측한 것이 아니라, 사용자가 놓쳤던 중요한 오류를 수정하고 오래된 백업 파일을 찾아냄으로써 복구 과정을 가능하게 했습니다."
}
