{
  "id": "1c80a3999ad87147",
  "title": "Anthropic's new hardware standard lets AI agents control the physical world",
  "url": "https://arstechnica.com/ai/2026/08/anthropics-new-hardware-standard-lets-ai-agents-control-the-physical-world/",
  "source": "Ars Technica",
  "type": "article",
  "tags": [
    "tech",
    "ai",
    "amazon web services",
    "anthropic",
    "automata"
  ],
  "published_at": "2026-08-27T22:15:43.000Z",
  "feed_id": "arstechnica",
  "description": "## 개요\n\nAnthropic이 개발한 새로운 하드웨어 표준인 MHS(Machine Hardware Standard)는 AI 에이전트가 실제 물리적 세계를 제어할 수 있도록 지원하며, 과학 연구 및 제조 분야에서의 AI 통합을 가속화하는 것을 목표로 합니다.\n\n## 주요 내용\n\n*   MHS는 AI 모델이 레이저 보정, 현미경 초점 조절 및 분석, 로봇 팔 조작 등 물리적 작업을 수행할 수 있도록 합니다.\n*   MHS-활성화된 모델은 API 스크립트를 작성하고 조정하여 여러 기기 간의 단계를 순차적으로 처리할 수 있습니다.\n*   하드웨어의 물리적 제약 조건, 조절 가능한 매개변수, 측정 옵션, 안전 한계 등을 설명하는 표준화된 태깅 시스템을 포함합니다.\n*   이 태깅 시스템은 AI 모델이 이전에 학습하지 않은 장치에 대한 중요 정보를 신속하게 제공하는 참조 파일로 통합될 수 있습니다.\n*   Anthropic은 현재 Amazon Web Services, Hugging Face, Raspberry Pi, Automata, Universal Robots와 같은 파트너와 MHS를 미리 테스트하고 있으며, 이는 AI 시스템이 물리적 장비를 운영하는 데 필요한 안전 평가 및 모범 사례 개발에 도움을 줄 것입니다.\n*   향후 MHS는 AI와 물리적 시스템을 통합하기 위한 오픈 소스이며 \"에이전트 비호환(agent agnostic)\" 표준이 될 계획입니다.\n*   초기 테스트에서 MHS는 장치 통합 시간을 단축하고 다양한 실험 환경에서 반복 속도를 높이는 데 기여했습니다.\n\n## 시사점\n\nMHS는 AI 에이전트가 물리적 세계와 상호작용하는 방식을 혁신하여, 가설 검증 및 일반 기술 개발 속도를 크게 단축시킴으로써 미래 기술 발전의 잠재력을 가속화할 수 있습니다."
}
