{
  "id": "5d0bb37a43a99551",
  "title": "A new way of coding!",
  "url": "https://dev.to/mdkaifansari04/a-new-way-of-coding-50cc",
  "source": "Dev.to",
  "type": "article",
  "tags": [
    "dev",
    "ai",
    "programming",
    "productivity",
    "opensource"
  ],
  "published_at": "2026-07-29T15:19:56.000Z",
  "feed_id": "devto"
}
