{
  "id": "ba8ba288b6fff9b7",
  "title": "MIT's Ad Hoc Committee on AI Use in Teaching, Learning, and Research Training",
  "url": "https://aiandeducation.mit.edu/report/",
  "source": "Hacker News",
  "type": "article",
  "tags": [
    "tech"
  ],
  "published_at": "2026-08-27T13:07:45.000Z",
  "feed_id": "hackernews"
}
