{
  "id": "ac5cbddce03d2647",
  "title": "Most people can't juggle one ball",
  "url": "https://www.lesswrong.com/posts/jTGbKKGqs5EdyYoRc/most-people-can-t-juggle-one-ball",
  "source": "Hacker News",
  "type": "article",
  "description": "Comments",
  "tags": [
    "tech"
  ],
  "published_at": "2026-04-09T12:35:20.000Z",
  "feed_id": "hackernews"
}
