{
  "id": "8f56b947c13aeacc",
  "title": "The quest to measure our relationship with nature",
  "url": "https://www.technologyreview.com/2026/04/16/1135245/measure-relationship-with-nature-index/",
  "source": "MIT Technology Review",
  "type": "article",
  "description": "As a movement, environmentalism has been pretty misanthropic. Understandably so—we humans have done some destructive things to the ecosystems around us. In the 21st century, though, mainstream conservation is learning that humans can be a force for good. Foresters are turning to Indigenous burning practices to prevent wildfires. Biologists are realizing that flower-dotted meadows were…",
  "tags": [
    "tech",
    "climate change and energy",
    "app"
  ],
  "published_at": "2026-04-16T10:00:00.000Z",
  "feed_id": "mittech"
}
