{
  "id": "ca9f400d473dd005",
  "title": "A Stranger Audited My AI Product for Free. Here's What They Found.",
  "url": "https://dev.to/alimafana/a-stranger-audited-my-ai-product-for-free-heres-what-they-found-3npd",
  "source": "Dev.to",
  "type": "article",
  "tags": [
    "dev",
    "a11y",
    "webdev",
    "ai",
    "buildinpublic"
  ],
  "published_at": "2026-04-20T15:23:01.000Z",
  "feed_id": "devto"
}
