{
  "id": "84f72dfbaf6a1c05",
  "title": "Anker made its own chip to bring AI to all its products",
  "url": "https://www.theverge.com/tech/916463/anker-thus-chip-announcement",
  "source": "The Verge",
  "type": "article",
  "tags": [
    "tech"
  ],
  "published_at": "2026-04-22T09:30:00.000Z",
  "feed_id": "theverge"
}
