{
  "id": "ee36772d4025d062",
  "title": "Why Is It So Hard to Fix an Electric Bike? (2026)",
  "url": "https://www.wired.com/story/why-is-it-so-hard-to-fix-an-electric-bike/",
  "source": "Wired",
  "type": "article",
  "description": "Bike shop mechanics have lost fingers and their shirts while repairing ebikes of dubious origins. Make sure yours is repairable and third-party certified.",
  "tags": [
    "tech",
    "gear",
    "gear / products",
    "gear / products / outdoor",
    "gear / reviews"
  ],
  "published_at": "2026-04-12T12:00:00.000Z",
  "feed_id": "wired"
}
