{
  "id": "3a9ca6764db21389",
  "title": "How to Build a Full-Stack AI Tools Directory App: The Complete Developer’s Guide (Next.js + Supabase)",
  "url": "https://dev.to/thefluxread/how-to-build-a-full-stack-ai-tools-directory-app-the-complete-developers-guide-nextjs--cg2",
  "source": "Dev.to",
  "type": "article",
  "tags": [
    "dev",
    "aitools",
    "appdevelopment",
    "developerguide",
    "fullstack"
  ],
  "published_at": "2026-09-19T16:41:38.000Z",
  "feed_id": "devto"
}
