{
  "id": "518ee304ea36da6e",
  "title": "Lessons Learned Building and Launching FugoFresh, a Calorie Counter Mobile App in 2026",
  "url": "https://dev.to/fugofresh/lessons-learned-building-and-launching-fugofresh-a-calorie-counter-mobile-app-in-2026-1gpn",
  "source": "Dev.to",
  "type": "article",
  "tags": [
    "dev",
    "ai",
    "beginners",
    "llm",
    "startup"
  ],
  "published_at": "2026-07-17T05:15:18.000Z",
  "feed_id": "devto",
  "description": "## 개요\n\nFugoFresh 앱 개발 및 출시 경험은 완벽주의 함정과 현실적인 개발 프로세스의 중요성을 보여줍니다.\n\n## 주요 내용\n\n*   **완벽주의의 함정:** 개발자는 완벽을 추구하며 장시간 코드 수정에 몰두했으나, 출시 후 예상치 못한 버그가 발생했습니다.\n*   **반복되는 수정 주기의 비효율성:** 초기 버그 발생 후, 개발자는 7개월간 추가 기능을 개발하고 완벽을 기하려 했지만, 이는 목표를 달성하지 못하는 순환으로 이어졌습니다.\n*   **관점 전환의 중요성:** 완벽함은 신의 영역이며 인간은 불완전한 결과물을 만들 수밖에 없다는 깨달음이 개발자에게 평화를 가져다주었습니다.\n*   **실행 중심의 접근 방식:** 버그가 발생하면 즉시 수정하고 업데이트를 배포하는 실행 중심적인 태도가 완벽주의보다 효과적이라는 결론에 도달했습니다.\n\n## 시사점\n\nFugoFresh 개발 경험은 소프트웨어 개발에서 완벽주의를 내려놓고, 빠른 피드백과 반복적인 개선을 통해 실제 사용자에게 가치를 전달하는 것이 더 중요하다는 교훈을 제공합니다."
}
