{
  "id": "f6cab1316852b87a",
  "title": "Computer use in Gemini 3.5 Flash",
  "url": "https://blog.google/innovation-and-ai/models-and-research/gemini-models/introducing-computer-use-gemini-3-5-flash/",
  "source": "Hacker News",
  "type": "article",
  "tags": [
    "tech"
  ],
  "published_at": "2026-06-24T17:21:34.000Z",
  "feed_id": "hackernews",
  "description": "## 개요\n\nGemini 3.5 Flash에 내장된 Computer use 기능은 개발자가 브라우저, 모바일, 데스크톱 환경 전반에 걸쳐 상호 작용하는 에이전트를 구축할 수 있도록 지원하며, 특히 장기적인 자동화 및 엔터프라이즈 워크플로우에서 성능을 향상시킵니다.\n\n## 주요 내용\n\n*   **Computer use 기능 통합:** Gemini 3.5 Flash에 Computer use 기능이 네이티브로 통합되어, 기존에 별도로 제공되던 Gemini 2.5 Computer use 모델의 기능을 메인 모델로 가져왔습니다.\n*   **향상된 에이전트 개발 지원:** 이 통합을 통해 개발자는 Gemini API 및 Gemini Enterprise Agent Platform을 사용하여 브라우저, 모바일, 데스크톱 환경에서 보고, 추론하며, 행동하는 사용자 정의 에이전트를 안정적으로 구축할 수 있습니다.\n*   **장기 및 엔터프라이즈 자동화 성능 개선:** 연속적인 소프트웨어 테스트, 전문 애플리케이션 전반의 지식 작업과 같은 장기 과제 및 엔터프라이즈 자동화 작업에서 성능이 향상되었습니다.\n*   **안전성 강화 조치:** 프롬프트 주입 위험을 완화하기 위해 Computer use 기능에 대한 표적 적대 훈련이 적용되었으며, 민감하거나 되돌릴 수 없는 작업에 대한 사용자 명시적 확인 또는 간접적인 프롬프트 주입 시 작업 자동 중지를 위한 두 가지 엔터프라이즈 안전 시스템이 제공됩니다.\n*   **보안 접근 방식 권장:** 개발자는 안전한 샌드박싱, 인간 루프 검증, 엄격한 액세스 제어와 같은 기능을 Computer use 기능과 결합하는 \"방어 심층\" 접근 방식을 사용하는 것이 권장됩니다.\n*   **실제 고객 사례:** 일부 고객은 Computer use 기능을 통해 가치를 창출하고 있으며, Gemini 앱 분석 및 자체 문서 접근성 문제 감사와 같은 사례가 언급되었습니다.\n\n## 시사점\n\nGemini 3.5 Flash의 Computer use 기능 통합은 에이전트 기반 시스템의 개발 및 배포를 간소화하고, 다양한 플랫폼에서 복잡한 작업을 자동화할 수 있는 강력하고 안전한 솔루션을 기업과 개발자에게 제공하며, AI 에이전트의 실무 적용 범위를 확장합니다."
}
