{
  "id": "fc87ead7eb37f5c5",
  "title": "Oracle tries to appease Stargate data center opponents with renewables push",
  "url": "https://arstechnica.com/gadgets/2026/09/oracle-promises-2-gw-of-renewables-to-match-stargate-data-center-emissions/",
  "source": "Ars Technica",
  "type": "article",
  "tags": [
    "tech",
    "ai data centers",
    "bloom energy",
    "data centers",
    "fuel cells"
  ],
  "published_at": "2026-09-11T18:22:22.000Z",
  "feed_id": "arstechnica"
}
