{
  "id": "2ab801d6f086ade4",
  "title": "AI data centers just got a government-mandated fast lane to the grid",
  "url": "https://techcrunch.com/2026/06/18/ai-data-centers-just-got-a-government-mandated-fast-lane-to-the-grid/",
  "source": "TechCrunch",
  "type": "article",
  "tags": [
    "tech",
    "ai",
    "climate",
    "data centers",
    "electrical agrid"
  ],
  "published_at": "2026-06-18T17:49:23.000Z",
  "feed_id": "techcrunch"
}
