{
  "id": "56d8f7ada46fcaa2",
  "title": "Gemma 4 and the End of API-Dependent AI",
  "url": "https://dev.to/akyavagal/gemma-4-and-the-end-of-api-dependent-ai-1bb8",
  "source": "Dev.to",
  "type": "article",
  "tags": [
    "dev",
    "devchallenge",
    "gemmachallenge",
    "gemma",
    "privacy"
  ],
  "published_at": "2026-05-15T16:06:22.000Z",
  "feed_id": "devto",
  "description": "## 개요\n\nGemma 4는 API 종속적인 AI 개발 모델에서 벗어나, 개발자가 직접 AI를 소유하고 활용하는 로컬 AI 시대를 열어줄 잠재력을 지니고 있습니다.\n\n## 주요 내용\n\n*   **API 종속적 AI의 한계**: 기존 AI 시스템은 외부 API를 통해 지능을 '임대'하는 방식으로 운영되어, API 호출에 따른 지연, 비용, 개인정보 보호, 벤더 종속성 등의 문제를 안고 있었습니다. 이러한 구조는 애플리케이션의 아키텍처, 비용, 성능, 개인정보 보호, 확장성에 영향을 미쳤습니다.\n*   **Gemma 4와 'AI 소유'의 전환**: Gemma 4는 단순히 벤치마크 성능 향상을 넘어, 개발자가 AI를 '소유'할 수 있게 함으로써 이러한 패러다임을 전환합니다. 이는 \"어떤 모델이 최고인가?\"라는 질문에서 \"시스템의 얼마나 많은 부분이 원격 모델을 필요로 하는가?\"라는 질문으로의 변화를 가져옵니다.\n*   **실용성과 효율성의 중요성**: 실제 제품 개발에서는 최고 성능의 모델보다 요약, 변환, 구조화된 출력, 로그 분석 등 일반적인 워크로드에 '충분히 좋은' 모델이 더 중요합니다. 로컬에서 실행되는 빠르고, 개인정보를 보호하며, 비용 효율적인 모델은 벤치마크 점수가 낮더라도 전체 시스템에서 더 나은 경험을 제공할 수 있습니다.\n*   **로컬 AI의 개발 경험 변화**: API 호출의 마찰(지연, 비용, 속도 제한)이 사라지고, 응답이 즉각적이며, 반복 및 실험이 거의 무료로 이루어져 개발 경험이 향상됩니다. AI가 서비스가 아닌 시스템의 일부가 됩니다.\n*   **개인정보 보호의 구조적 강화**: 로컬 AI는 개인정보 보호를 '기능'이 아닌 '구조'로 만들어, 내부 도구, 독점 코드 분석, 보안 시스템, 규제 환경, 오프라인 애플리케이션 등 민감한 데이터를 외부로 전송할 필요가 없는 다양한 소프트웨어 구축을 용이하게 합니다.\n*   **경제적 전환**: API 기반 AI의 종량제 방식과 사용량 증가에 따른 비용 상승에서 벗어나, 로컬 AI는 비용 안정화와 통제력 강화를 제공하며, AI를 계량 서비스에서 인프라로 전환시킵니다.\n*   **실제 적용 사례**: Gemma 4를 활용한 로컬 AI 시스템은 보안 이벤트를 분석하고 위협을 설명하며 실행 가능한 권장 사항을 제공하여, API 비용에 대한 걱정 없이 더 빠른 반복 주기와 민감한 데이터에 대한 완전한 통제를 가능하게 합니다. fragmented logs를 coherent attack narrative로 변환합니다.\n*   **AI 발전의 반복 주기**: 컴퓨팅 역사에서 중앙 집중식에서 분산식으로, 다시 중앙 집중식으로 이동하는 주기가 반복되었듯, AI 또한 원격 시스템에서 개발자에게 가까워지는 변화를 겪고 있습니다.\n*   **최첨단 모델의 지속적인 중요성**: 로컬 AI가 부상하더라도, 고급 추론, 복잡한 문제 해결, 연구 등에서는 최첨단 모델과 API의 중요성이 여전히 유지될 것입니다. 그러나 '최고'와 '실제 시스템에 충분한' 수준 사이의 격차는 빠르게 줄어들고 있습니다.\n*   **Gemma 4의 의미**: Gemma 4는 강력한 AI가 더 이상 중앙 집중화될 필요가 없다는 가정의 변화를 나타냅니다. 개발자들이 AI를 로컬에서 실행할 수 있다는 점을 인지하게 되면, 소프트웨어의 경제성과 아키텍처가 변화하기 시작합니다.\n\n## 시사점\n\nGemma 4와 같은 로컬 AI 솔루션은 개발자가 '최고의 모델'을 찾는 대신, '최적의 시스템'을 구축할 수 있도록 지원하며, AI를 소유하고 통제할 수 있는 새로운 시대의 가능성을 제시합니다."
}
