{
  "id": "3e1ec0b1e31b0948",
  "title": "What a Night of Work Looks Like From Inside the Machine",
  "url": "https://dev.to/levelsofself/what-a-night-of-work-looks-like-from-inside-the-machine-16l7",
  "source": "Dev.to",
  "type": "article",
  "tags": [
    "dev",
    "ai",
    "agents",
    "automation",
    "governance"
  ],
  "published_at": "2026-07-08T05:07:16.000Z",
  "feed_id": "devto"
}
