{
  "id": "de19c0645a3e58b8",
  "title": "MAI-Thinking-1: Microsoft's New Reasoning Model and What It Means for Developers",
  "url": "https://dev.to/arshtechpro/mai-thinking-1-microsofts-new-reasoning-model-and-what-it-means-for-developers-2fma",
  "source": "Dev.to",
  "type": "article",
  "tags": [
    "dev",
    "ai",
    "microsoft",
    "llm",
    "agents"
  ],
  "published_at": "2026-06-05T16:24:31.000Z",
  "feed_id": "devto",
  "description": "## 개요\n\nMicrosoft가 자체 개발한 최초의 추론 모델인 MAI-Thinking-1은 복잡한 다단계 작업을 위해 설계된 중간 규모의 모델로, 소프트웨어 엔지니어링 및 수학 벤치마크에서 강력한 성능을 발휘하며 개발자에게 새로운 가능성을 제시합니다.\n\n## 주요 내용\n\n*   **MAI-Thinking-1의 특징:** Microsoft AI(MAI) 연구소에서 개발한 추론 중심 언어 모델로, 350억 개의 활성 매개변수와 약 1조 개의 총 매개변수를 가진 Sparse Mixture of Experts (MoE) 아키텍처를 사용합니다. 이는 일반적인 MoE 모델보다 추론 비용이 훨씬 적게 들면서도 높은 수준의 추론 품질을 제공합니다.\n*   **주요 벤치마크 성능:** AIME 2025/2026 수학 경쟁에서 97.0% 및 94.5%의 높은 정확도를 보였으며, SWE-Bench Pro에서는 Claude Opus 4.6과 동등한 성능을 달성했습니다. 또한, Surge 평가단에 의한 인간 평가에서 Claude Sonnet 4.6보다 선호되었습니다.\n*   **차별화된 학습 철학:** MAI-Thinking-1은 외부 모델의 지식을 증류(distillation)하지 않고 자체 데이터를 사용하여 처음부터 학습되었습니다. 이는 모델이 진정한 추론 능력을 학습하고 새로운 상황에 더 잘 일반화될 수 있도록 합니다. 또한, 상업적으로 라이선스가 부여된 데이터만 사용하고 AI 생성 콘텐츠는 제외하여 기업 고객의 저작권 노출 위험을 줄입니다.\n*   **개발자 친화적인 기능:** 256,000 토큰의 긴 컨텍스트 창을 지원하여 대규모 코드베이스나 문서 처리가 용이하며, Function calling/tool use 기능을 갖추고 있습니다. Multi-layer instructions를 따르도록 훈련되어 시스템 프롬프트, 사용자 지침 및 제약 조건이 예측 가능하게 상호 작용합니다. OpenAI Chat Completions API와 호환되어 기존 OpenAI API 호출 코드를 최소한의 수정으로 마이그레이션할 수 있습니다.\n*   **기업 보안 및 컴플라이언스:** Microsoft Foundry를 통해 데이터 상주 제어, 감사 로깅, 비공개 네트워킹 옵션 등 엔터프라이즈 보안 및 컴플라이언스 기능을 제공합니다.\n*   **활용 시나리오:** Agentic 코딩 파이프라인 (코드 검토, 버그 수정, 코드 생성), 복잡한 추론 작업 (재무 모델링, 기술 분석), 엔터프라이즈 문서 처리 (계약서, 기술 문서), 그리고 고용량 일상 워크플로우에 적합합니다.\n*   **안전 접근 방식:** 안전성을 후처리 필터가 아닌 기능 학습과 동일한 강화 학습 루프에서 훈련했습니다. 이를 통해 유해한 요청은 거부하면서도 합법적인 개발자 요청에 대한 과도한 거부를 줄이는 것을 목표로 합니다.\n\n## 시사점\n\nMAI-Thinking-1은 개발자가 복잡한 작업을 수행하고, 대규모 코드를 처리하며, 기업 수준의 보안 및 규정 준수를 유지하는 데 필요한 기능을 제공함으로써 AI 기반 애플리케이션 개발에 새로운 기준을 제시합니다."
}
